<?xml version='1.0' encoding='UTF-8'?>
<!ELEMENT root (user)*>
<!ELEMENT user (name|password)*>
<!ATTLIST user
    id CDATA #IMPLIED
    type CDATA #IMPLIED
  >
<!ELEMENT name (#PCDATA)>
<!ELEMENT password (#PCDATA)>
